{
  "$schema": "http://json-schema.org/draft-07/schema#",
  "$id": "https://github.com/SysAdminDoc/LogVerdict/blob/main/Data/verdicts.schema.json",
  "title": "LogVerdict verdict database",
  "description": "Curated rulings on Windows log signatures. Editors that understand JSON Schema will validate and autocomplete against this; Test-LogVerdictDatabase enforces the same rules plus the ones a schema cannot express.",
  "type": "object",
  "required": [
    "schemaVersion",
    "name",
    "updated",
    "rules"
  ],
  "additionalProperties": false,
  "properties": {
    "schemaVersion": {
      "type": "integer",
      "minimum": 1,
      "maximum": 5,
      "description": "Loading a version this build does not understand is a hard failure, not a best effort. v3 adds per-rule sources[] so attribution obligations travel with the rule. v4 adds the 'reliability' match source, which an earlier build cannot collect at all. v5 adds the correlations[] array."
    },
    "name": {
      "type": "string",
      "minLength": 1
    },
    "updated": {
      "type": "string",
      "pattern": "^\\d{4}-\\d{2}-\\d{2}$"
    },
    "notes": {
      "type": "string"
    },
    "rules": {
      "type": "array",
      "items": {
        "$ref": "#/definitions/rule"
      }
    },
    "correlations": {
      "type": "array",
      "description": "Curated pairings of rules that mean more together than apart. Deliberately curated and never inferred: on a single machine the loudest signature co-occurs with everything, so a discovered correlation is almost always an artefact of volume rather than a cause.",
      "items": {
        "$ref": "#/definitions/correlationRule"
      }
    }
  },
  "definitions": {
    "correlationRule": {
      "type": "object",
      "required": [
        "id",
        "correlation",
        "verdict",
        "title",
        "plain",
        "why",
        "action",
        "confidence"
      ],
      "additionalProperties": false,
      "properties": {
        "id": {
          "type": "string",
          "pattern": "^[A-Za-z][A-Za-z0-9-]*$",
          "description": "Shipped correlations use LVC-nnnn so they cannot collide with rule ids."
        },
        "status": {
          "enum": ["stable", "test", "experimental", "deprecated", "unsupported"]
        },
        "verified": {
          "type": "string",
          "pattern": "^\\d{4}-\\d{2}-\\d{2}$"
        },
        "correlation": {
          "$ref": "#/definitions/correlation"
        },
        "verdict": {
          "enum": ["benign", "informational", "unknown", "investigate", "actionable", "critical"]
        },
        "title": { "type": "string", "minLength": 1 },
        "plain": { "type": "string", "minLength": 1 },
        "why": { "type": "string", "minLength": 1 },
        "action": { "type": "string", "minLength": 1 },
        "confidence": { "enum": ["high", "medium", "low"] },
        "references": {
          "type": "array",
          "items": { "type": "string", "format": "uri" }
        },
        "falsepositives": {
          "type": "array",
          "items": { "type": "string" }
        },
        "sources": {
          "type": "array",
          "description": "Where this ruling came from, same shape as a rule's sources[].",
          "items": {
            "type": "object",
            "required": ["uri"],
            "additionalProperties": false,
            "properties": {
              "uri": { "type": "string", "format": "uri" },
              "licence": { "type": "string" },
              "author": { "type": "string" },
              "retrieved": { "type": "string", "pattern": "^\\d{4}-\\d{2}-\\d{2}$" },
              "modified": { "type": "boolean" }
            }
          }
        },
        "provenance": {
          "enum": ["internal-observation"],
          "description": "Explicit provenance for a curated correlation derived from repeatable in-repository observation rather than a published source."
        }
      }
    },
    "correlation": {
      "type": "object",
      "required": ["type", "rules", "timespan"],
      "additionalProperties": false,
      "description": "Vocabulary follows the Sigma Correlation Rules Specification v2.1.0 so anyone who reads Sigma can read these. The WINDOW does not: Sigma buckets time into fixed intervals, which misses a pair straddling a boundary while matching an unrelated pair at opposite ends of one bucket. This slides instead.",
      "properties": {
        "type": {
          "enum": ["temporal", "temporal_ordered", "event_count"],
          "description": "temporal: every referenced rule occurred inside one window. temporal_ordered: additionally, their first occurrences follow the declared order."
        },
        "rules": {
          "type": "array",
          "minItems": 1,
          "items": { "type": "string" },
          "description": "Rule ids that must co-occur. For temporal_ordered the array order is the required order."
        },
        "timespan": {
          "type": "string",
          "pattern": "^\\d+[smhd]$",
          "description": "Sliding window width: 30s, 5m, 2h, 1d. An unparseable value is skipped loudly rather than defaulted, because a correlation that silently never fires looks exactly like a healthy machine."
        },
        "group-by": {
          "type": "array",
          "items": { "type": "string" },
          "description": "Sigma's grouping keys. On a single PC the useful ones are service name, process image and device instance - never user or host, which are constant."
        }
      }
    },
    "rule": {
      "type": "object",
      "required": [
        "id",
        "match",
        "verdict",
        "title",
        "plain",
        "why",
        "action",
        "confidence"
      ],
      "additionalProperties": false,
      "allOf": [
        {
          "if": {
            "properties": { "confidence": { "const": "draft" } },
            "required": ["confidence"]
          },
          "then": {
            "properties": { "status": { "const": "unsupported" } },
            "required": ["status"]
          }
        }
      ],
      "properties": {
        "id": {
          "type": "string",
          "pattern": "^[A-Za-z][A-Za-z0-9-]*$",
          "description": "Unique and stable. Shipped rules use LV-nnnn; site-local rules should use their own prefix so they cannot collide."
        },
        "status": {
          "enum": [
            "stable",
            "test",
            "experimental",
            "deprecated",
            "unsupported"
          ],
          "description": "Sigma-aligned lifecycle. deprecated and unsupported rules are retained for traceability but never applied to a signature."
        },
        "verified": {
          "type": "string",
          "pattern": "^\\d{4}-\\d{2}-\\d{2}$",
          "description": "When this ruling was last checked against reality. Guidance ages; the validator fails rules older than 24 months."
        },
        "locale": {
          "type": "string",
          "pattern": "^[a-z]{2}(-[A-Za-z0-9]+)*$",
          "description": "Required when messagePattern matches event text, which Windows renders from localized resources. Compared on the language part only, so en-US also matches en-GB."
        },
        "match": {
          "$ref": "#/definitions/match"
        },
        "verdict": {
          "enum": [
            "benign",
            "informational",
            "unknown",
            "investigate",
            "actionable",
            "critical"
          ],
          "description": "benign is suppressed by default. Do not reach for critical unless hardware or data integrity is genuinely at risk."
        },
        "title": {
          "type": "string",
          "minLength": 1,
          "description": "One line, plain English, no jargon."
        },
        "plain": {
          "type": "string",
          "minLength": 1,
          "description": "What actually happened, for someone who does not already know."
        },
        "why": {
          "type": "string",
          "minLength": 1,
          "description": "Why it does or does not matter. This is where judgement belongs."
        },
        "action": {
          "type": "string",
          "minLength": 1,
          "description": "The concrete next step. 'Ignore.' is a complete and often correct answer."
        },
        "escalate": {
          "$ref": "#/definitions/escalate"
        },
        "confidence": {
          "enum": [
            "high",
            "medium",
            "low",
            "draft"
          ],
          "description": "How certain the ruling is. Restating a self-describing message is high; adding interpretation is medium. draft is reserved for an inactive, model-generated local candidate with status unsupported; a reviewer must replace both fields before it can match."
        },
        "references": {
          "type": "array",
          "items": {
            "type": "string",
            "format": "uri"
          },
          "description": "Sources backing the ruling. Strongly encouraged for anything asserting what a vendor recommends."
        },
        "falsepositives": {
          "type": "array",
          "items": {
            "type": "string"
          },
          "description": "When this ruling is wrong. The most valuable field in the file: a verdict is only useful if the reader can tell it does not apply to them."
        },
        "related": {
          "type": "array",
          "items": {
            "type": "object",
            "required": [
              "id",
              "type"
            ],
            "additionalProperties": false,
            "properties": {
              "id": {
                "type": "string"
              },
              "type": {
                "enum": [
                  "derived",
                  "obsolete",
                  "merged",
                  "renamed",
                  "similar"
                ]
              }
            }
          }
        },
        "sources": {
          "type": "array",
          "description": "Where this ruling came from, and under what terms. Required for anything derived from a licensed corpus: CC-BY-4.0 obliges attribution and an indication of changes, and DRL-1.1 obliges the author be shown at match time.",
          "items": {
            "type": "object",
            "required": [
              "uri"
            ],
            "additionalProperties": false,
            "properties": {
              "uri": {
                "type": "string",
                "format": "uri",
                "description": "Where the claim can be checked."
              },
              "licence": {
                "type": "string",
                "description": "Terms the source is published under, e.g. CC-BY-4.0, DRL-1.1, MIT. Omit for a source merely consulted rather than derived from."
              },
              "author": {
                "type": "string",
                "description": "Original rule author. DRL-1.1 requires this be displayed on every match."
              },
              "retrieved": {
                "type": "string",
                "pattern": "^\\d{4}-\\d{2}-\\d{2}$",
                "description": "ISO date the source was read."
              },
              "modified": {
                "type": "boolean",
                "description": "True when the prose was adapted rather than reproduced. CC-BY-4.0 requires changes be indicated."
              }
            }
          }
        },
        "provenance": {
          "enum": ["internal-observation"],
          "description": "Explicit provenance for a curated rule derived from repeatable in-repository observation rather than a published source."
        }
      }
    },
    "match": {
      "type": "object",
      "additionalProperties": false,
      "description": "More match keys means higher specificity, and the most specific matching rule wins.",
      "properties": {
        "source": {
          "enum": [
            "event",
            "textlog",
            "reliability"
          ],
          "description": "Which collector produced the signature. 'reliability' is Reliability Monitor, whose records are structured like events and match on provider and event id."
        },
        "channel": {
          "type": "string",
          "description": "Event channel name, the text-log target name such as CBS or SetupAPI, or 'Reliability'."
        },
        "provider": {
          "type": "string",
          "description": "Event provider. A trailing * matches a provider family."
        },
        "eventId": {
          "type": "integer"
        },
        "messagePattern": {
          "type": "string",
          "format": "regex",
          "description": "Regex against the sample message. For event sources this is locale-dependent, so declare 'locale' too."
        }
      }
    },
    "escalate": {
      "type": "object",
      "required": [
        "perDay",
        "verdict",
        "why"
      ],
      "additionalProperties": false,
      "description": "Rate-based escalation, for signatures that are noise at a trickle and a fault at volume.",
      "properties": {
        "perDay": {
          "type": "number",
          "exclusiveMinimum": 0
        },
        "verdict": {
          "enum": [
            "benign",
            "informational",
            "unknown",
            "investigate",
            "actionable",
            "critical"
          ]
        },
        "why": {
          "type": "string",
          "minLength": 1
        }
      }
    }
  }
}
