{
  "schemaVersion": 4,
  "name": "LogVerdict core verdict database",
  "updated": "2026-07-31",
  "notes": "Rules are evaluated most-specific first. A signature matching no rule is reported as 'unknown' with its raw evidence - never with a guessed cause. Each rule carries a 'verified' date because guidance ages, and a 'status' controlling whether it is used: stable and test rules match, experimental rules match, deprecated and unsupported rules are retained for traceability but never applied.",
  "rules": [
    {
      "id": "LV-0001",
      "status": "stable",
      "verified": "2026-07-31",
      "match": {
        "source": "event",
        "provider": "Microsoft-Windows-DistributedCOM",
        "eventId": 10016
      },
      "verdict": "benign",
      "title": "DCOM permission warning that Windows logs by design",
      "plain": "A component asked to start a COM server using an account that does not hold Launch permission for it. Windows logs the attempt and then carries on using a different path. Nothing is broken.",
      "why": "Microsoft documents these entries as expected on stock installs and advises against editing the DCOM permissions to silence them - the registry and DCOM config surgery commonly recommended online carries more risk than the warning does.",
      "action": "Ignore. Do not edit DCOM permissions to make it stop.",
      "confidence": "high",
      "references": [
        "https://learn.microsoft.com/en-us/answers/questions/3157934/how-to-resolve-distributedcom-event-id-10016"
      ],
      "falsepositives": [],
      "sources": [
        {
          "uri": "https://learn.microsoft.com/en-us/troubleshoot/windows-client/application-management/event-10016-logged-when-accessing-dcom",
          "retrieved": "2026-07-31"
        }
      ]
    },
    {
      "id": "LV-0002",
      "status": "stable",
      "verified": "2026-07-31",
      "match": {
        "source": "event",
        "provider": "Microsoft-Windows-DistributedCOM",
        "eventId": 10010
      },
      "verdict": "informational",
      "title": "A COM server did not register within the timeout",
      "plain": "A program started a background COM component, and the component took longer than DCOM's timeout to check in. This is usually a slow-startup timing artifact rather than a fault.",
      "why": "Extremely common on machines with heavy startup load or slow storage. Only meaningful if it lines up with a feature that visibly fails.",
      "action": "Ignore unless it coincides with a specific application misbehaving.",
      "confidence": "high",
      "references": [],
      "falsepositives": [
        "Slow storage or heavy startup load delays a COM server past the timeout with no functional impact."
      ]
    },
    {
      "id": "LV-0003",
      "status": "stable",
      "verified": "2026-07-31",
      "match": {
        "source": "event",
        "provider": "Microsoft-Windows-DistributedCOM",
        "eventId": 10005
      },
      "verdict": "investigate",
      "title": "DCOM could not start a service something asked for",
      "plain": "A program asked DCOM to launch a Windows service on its behalf, and the service did not start. The message names both the service and the Windows error code that stopped it.",
      "why": "DCOM is the messenger here, not the fault. The event id on its own says nothing useful - the service name and the error code inside the message are the diagnosis, and they differ completely from one occurrence to the next. This is why the DCOM reconfiguration commonly recommended for it changes nothing.",
      "action": "Read the service name and the error code out of the message, then investigate that service directly. Do not reconfigure DCOM.",
      "confidence": "medium",
      "references": [
        "https://learn.microsoft.com/en-us/answers/questions/4338635/distributed-com-errors-10005"
      ],
      "falsepositives": [
        "A service deliberately disabled, or a per-user service absent by design, produces this every time something asks for it."
      ]
    },
    {
      "id": "LV-0010",
      "status": "stable",
      "verified": "2026-07-31",
      "match": {
        "source": "event",
        "provider": "Microsoft-Windows-WHEA-Logger",
        "eventId": 17
      },
      "verdict": "investigate",
      "title": "Hardware reported an error and corrected it itself",
      "plain": "The hardware hit an error, caught it, and fixed it without data loss. Nothing failed this time. A steady trickle is normal on many systems; a rising rate is how failing memory, a failing PCIe link or an unstable overclock announces itself before it becomes a crash.",
      "why": "Corrected errors are not harmless in aggregate - they are the early-warning channel for the uncorrected kind.",
      "action": "Record the current rate. Compare against a scan a week from now. If it is climbing, identify the reporting component from the event detail, then test memory and reseat or move the affected card.",
      "escalate": {
        "perDay": 25,
        "verdict": "actionable",
        "why": "A high sustained rate of corrected errors usually precedes an uncorrected one."
      },
      "confidence": "high",
      "references": [],
      "falsepositives": [
        "A low steady trickle of corrected errors is normal on much server-class and ECC hardware."
      ]
    },
    {
      "id": "LV-0011",
      "status": "stable",
      "verified": "2026-07-31",
      "match": {
        "source": "event",
        "provider": "Microsoft-Windows-WHEA-Logger",
        "eventId": 18
      },
      "verdict": "critical",
      "title": "Hardware reported an error it could NOT correct",
      "plain": "The hardware hit an error it was unable to fix. This is the class of fault that produces blue screens and silent data corruption.",
      "why": "Uncorrected machine check errors are hardware faults, not software ones. No amount of driver reinstalling addresses them.",
      "action": "Treat as a hardware fault. Test memory, check CPU and board temperatures and power delivery, remove any overclock, and plan replacement of the reporting component.",
      "confidence": "high",
      "references": [],
      "falsepositives": []
    },
    {
      "id": "LV-0020",
      "status": "stable",
      "verified": "2026-07-31",
      "match": {
        "source": "event",
        "provider": "Microsoft-Windows-Kernel-Power",
        "eventId": 41
      },
      "verdict": "actionable",
      "title": "The PC lost power or froze rather than shutting down",
      "plain": "Windows found on boot that the previous session ended without a clean shutdown. The machine either blue screened, froze solid, lost power, or was held down at the power button.",
      "why": "This event records the aftermath, never the cause. The cause lives in the crash dump or in the events immediately preceding it.",
      "action": "Correlate against BugCheck 1001 and any minidump written at the same timestamp. No dump and no BugCheck alongside it points at power delivery, thermal shutdown, or a hard hang rather than a software crash.",
      "confidence": "high",
      "references": [],
      "falsepositives": [
        "A deliberate hard power-off or a held power button produces this with no fault behind it."
      ],
      "sources": [
        {
          "uri": "https://learn.microsoft.com/en-us/troubleshoot/windows-client/performance/event-id-41-restart",
          "retrieved": "2026-07-31"
        }
      ]
    },
    {
      "id": "LV-0021",
      "status": "stable",
      "verified": "2026-07-31",
      "match": {
        "source": "event",
        "provider": "Microsoft-Windows-WER-SystemErrorReporting",
        "eventId": 1001
      },
      "verdict": "actionable",
      "title": "Blue screen recorded with its stop code",
      "plain": "Windows crashed and wrote the bug check code into this event. The code and its four parameters identify which subsystem gave up.",
      "why": "This is the single most informative record of a crash that is available without opening the dump in a debugger.",
      "action": "Read the bug check code from the event detail. Pair it with the matching minidump under C:\\Windows\\Minidump for the faulting driver.",
      "confidence": "high",
      "references": [],
      "falsepositives": []
    },
    {
      "id": "LV-0022",
      "status": "stable",
      "verified": "2026-07-31",
      "match": {
        "source": "event",
        "provider": "EventLog",
        "eventId": 6008
      },
      "verdict": "investigate",
      "title": "Previous shutdown was unexpected",
      "plain": "Windows is reporting that the last session ended abnormally, and gives the time it stopped.",
      "why": "Companion record to Kernel-Power 41. Useful mainly for pinning down exactly when the machine died.",
      "action": "Use the timestamp to find what was happening in the seconds before it.",
      "confidence": "high",
      "references": [],
      "falsepositives": [
        "Follows any unclean shutdown including intentional ones."
      ]
    },
    {
      "id": "LV-0030",
      "status": "stable",
      "verified": "2026-07-31",
      "match": {
        "source": "event",
        "provider": "disk",
        "eventId": 51
      },
      "verdict": "actionable",
      "title": "Disk error during a paging operation",
      "plain": "A read or write to the disk failed while Windows was paging memory. The storage device did not complete an operation the OS required.",
      "why": "Paging errors mean the failure reached the point where Windows could not rely on the disk. Cabling, the controller, or the drive itself is at fault.",
      "action": "Check the drive's SMART data, verify cabling and power, and back up before further troubleshooting.",
      "confidence": "high",
      "references": [],
      "falsepositives": []
    },
    {
      "id": "LV-0031",
      "status": "stable",
      "verified": "2026-07-31",